"Zeitstempel","Wie viel Vorwissen haben Sie zu dem Thema des Textes?","Wie Glaubwürdig fanden Sie die Antwort?","Wie klar und verständlich war die Antwort?","Wie sachlich fanden Sie die Antwort?","Wie sehr vertrauen Sie den in der Antwort präsentierten Informationen?","Wie wahrscheinlich ist es, dass die Antwort missverstanden werden könnte?","Wie ausführlich fanden Sie die Antwort?","Wie sicher sind Sie, dass die Antwort korrekt ist?","Begründen Sie ihre Antworten (optional)","Wie viel Vorwissen haben Sie zu dem Thema des Textes?","Wie Glaubwürdig fanden Sie die Antwort?","Wie klar und verständlich war die Antwort?","Wie sachlich fanden Sie die Antwort?","Wie sehr vertrauen Sie den in der Antwort präsentierten Informationen?","Wie wahrscheinlich ist es, dass die Antwort missverstanden werden könnte?","Wie ausführlich fanden Sie die Antwort?","Wie sicher sind Sie, dass die Antwort korrekt ist?","Begründen Sie ihre Antworten (optional)","Wie viel Vorwissen haben Sie zu dem Thema des Textes?","Wie Glaubwürdig fanden Sie die Antwort?","Wie klar und verständlich war die Antwort?","Wie sachlich fanden Sie die Antwort?","Wie sehr vertrauen Sie den in der Antwort präsentierten Informationen?","Wie wahrscheinlich ist es, dass die Antwort missverstanden werden könnte?","Wie ausführlich fanden Sie die Antwort?","Wie sicher sind Sie, dass die Antwort korrekt ist?","Begründen Sie ihre Antworten (optional)","Wie viel Vorwissen haben Sie zu dem Thema des Textes?","Wie Glaubwürdig fanden Sie die Antwort?","Wie klar und verständlich war die Antwort?","Wie sachlich fanden Sie die Antwort?","Wie sehr vertrauen Sie den in der Antwort präsentierten Informationen?","Wie wahrscheinlich ist es, dass die Antwort missverstanden werden könnte?","Wie ausführlich fanden Sie die Antwort?","Wie sicher sind Sie, dass die Antwort korrekt ist?","Begründen Sie ihre Antworten (optional)","Wie oft nutzen Sie KI-Chat-Systeme zur Informationsbeschaffung?","Was hat Sie dazu gebracht der Antwort zu Vertrauen oder nicht zu Vertrauen? (optional)","Wie würden Sie das KI-System insgesamt bewerten?
(Schulnoten)","Haben Sie Vorschläge, wie man die Antworten & deren Glaubwürdigkeit verbessern könnte?","Für wie sinnvoll erachten Sie Quellenangaben in einem KI-Chat? ","Begründen Sie Ihre Antworten (optional)","Ich beschäftige mich gern genauer mit technischen Systemen.","Ich probiere gern die Funktionen neuer technischer Systeme aus.","In erster Linie beschäftige ich mich mit technischen Systemen, weil ich muss.","Wenn ich ein neues technisches System vor mir habe, probiere ich es intensiv aus.","Ich verbringe sehr gern Zeit mit dem Kennenlernen eines neuen technischen Systems.","Es genügt mir, dass ein technisches System funktioniert, mir ist es egal, wie oder warum.","Ich versuche zu verstehen, wie ein technisches System genau funktioniert.","Es genügt mir, die Grundfunktionen eines technischen Systems zu kennen.","Ich versuche, die Möglichkeiten eines technischen Systems vollständig auszunutzen.","Geben Sie Ihren Vor- & Nachnamen an.
(nur nötig für VP Stunden)","Geben Sie Ihre Matrikelnummer an
(nur nötig für VP Stunden)","Welchen höchsten Bildungsabschluss haben Sie erreicht?","Wie alt sind Sie?","Geben Sie ihr Geschlecht an."
"2025/03/17 5:00:03 PM MEZ","3","7","4","7","2","5","6","2","","1","3","4","5","2","6","4","2","","2","2","2","3","3","2","2","3","","5","6","6","4","5","5","4","6","","Nie","Mein Vorwissen dazu und wie plausibel die Antworten klangen. Außerdem, ob der Text fehlerfrei formuliert war, ob Wörter fehlten und ob es professionell wirkte.","3","","7","","2","3","3","4","3","6","1","5","4","","","Bachelor","26","weiblich"
"2025/03/21 6:10:47 PM MEZ","2","6","6","7","6","5","4","4","","1","3","5","6","3","3","5","3","","2","5","7","6","6","6","5","4","","5","7","6","6","7","6","4","6","","Paar mal in der Woche","","2","Quellen bei den Antworten, ausführliche Antworten mit Fachbegriffe zu den spezifischen themen","5","","4","5","2","4","5","3","3","4","3","Rafin Uddin","2386119","Abitur","23","männlich"
"2025/03/24 7:42:31 AM MEZ","5","6","6","6","6","2","4","6","","2","5","6","6","4","4","5","4","","1","3","4","4","5","6","4","4","","4","6","6","6","6","2","4","6","","Nie","","3","","6","","2","3","5","2","2","5","3","3","3","","","Bachelor","59","männlich"